workorder,date_time_opened,date_time_closed,registration,total_time,ata_code,problem,date,action,cluster,cluster_name
1114877,2012-09-04 07:10:00,2012-09-06 16:02:00,N556ND,7821.599999999999,7100.0,ENG CHANGE DUE.,2012-09-06,"RAN ENGINE, ADJUSTED IDLE SPEED & MIXTURE TO SPECS. OPS & LEAK CHECK GOOD.",c_31,mixture adjust mixture control
1115866,2012-09-28 06:47:00,2012-09-28 14:03:00,N529ND,10844.8,7610.0,IDLE MIXTURE CHECK PRODUCES NO RISE.,2012-09-28,ADJUSTED IDLE MIXTURE.,c_31,mixture adjust mixture control
1116125,2012-10-08 07:13:00,2012-10-08 10:17:00,N572ND,6231.9,7320.0,ENGINE FAILS TO IDLE.,2012-10-08,ADJUSTED IDLE MIXTURE & IDLE RPM. ENGINE IDLE OPS CHECK GOOD.,c_31,mixture adjust mixture control
1116274,2012-10-11 13:51:00,2012-10-11 14:38:00,N512ND,8512.6,7100.0,"UPON LEVELING OFF AT 1600 FT, EXPERIENCED ENGINE ROUGHNESS. DURING DESCENT TO LANDING WHEN POWER WAS ADDED IT WAS DELAYED.",2012-10-11,"RAN A/C THROUGH VARIOUS POWER & MIXTURE SETTINGS, NO DEFECTS NOTED. COULD NOT DUPLICATE DISCREP.",c_31,mixture adjust mixture control
1116366,2012-10-15 07:04:00,2012-10-15 12:54:00,N550ND,7256.400000000001,7600.0,"ON RUN UP, WHEN DOING IDLE CHECK, RPM DROPPED TO ~500, SPITTING & SPUTTERING. SOUNDED LIKE WAS GOING TO QUIT.",2012-10-15,RESET IDLE RPM & MIXTURE SETTINGS. OPS CHECKED GOOD.,c_31,mixture adjust mixture control
1116438,2012-10-16 09:44:00,2012-10-16 11:31:00,N567ND,4773.3,400.0,"AD 2001-06-17, IMPROPER FUEL FLOW SETTINGS DUE. EFF DATE 4/20/01.",2012-10-16,ADJUSTED MIXTURE & IDLE RPM TO SPECS. OPS CHECK GOOD. NEXT DUE ON CONDITION.,c_31,mixture adjust mixture control
1116514,2012-10-17 19:43:00,2012-10-19 14:11:00,N548ND,5101.200000000001,7610.0,MIXTURE DOES NOT HIT FULL RICH ON TRAVEL.,2012-10-18,"ADJUSTED CONTROL ROD END, OPS CHECK GOOD. INSTALLED NEW COTTER PIN.",c_31,mixture adjust mixture control
1116519,2012-10-18 07:38:00,2012-10-19 14:59:00,N515ND,7564.0,7320.0,"IDLE MIXTURE RISE, 60 - 70 RPM.",2012-10-18,ADJUSTED MIXTURE.,c_31,mixture adjust mixture control
1116519,2012-10-18 07:38:00,2012-10-19 14:59:00,N515ND,7564.0,7320.0,"IDLE MIXTURE RISE, 60 - 70 RPM.",2012-10-19,OPS CHECKED IDLE & MIXTURE NOTING NO DISCREP.,c_31,mixture adjust mixture control
1116588,2012-10-21 10:52:00,2012-10-22 15:27:00,N557ND,6494.2,7200.0,NORMAL COLD ENGINE START PROPER LEAN & NORMAL TAXI. ENGINE FAILED AS STARTED TURN OFF OF RAMP.,2012-10-21,RAN A/C & FOUND IDLE MIXTURE TO HAVE 450 IDLE CUT OFF RISE. ADJUSTED MIXTURE TO SPECS. A/C WILL NOT START. REMOVED ENGINE COWLS.,c_31,mixture adjust mixture control
1116588,2012-10-21 10:52:00,2012-10-22 15:27:00,N557ND,6494.2,7200.0,NORMAL COLD ENGINE START PROPER LEAN & NORMAL TAXI. ENGINE FAILED AS STARTED TURN OFF OF RAMP.,2012-10-22,REPLACED FUEL SERVO W/ S/N 70DB1303. REPLACED L/H & R/H MAGNETOS ON PD 2 & 3. ADJUSTED MIXTURE & IDLE SETTINGS. ENGINE RUN UP & LEAK CHECK GOOD.,c_31,mixture adjust mixture control
1116588,2012-10-21 10:52:00,2012-10-22 15:27:00,N557ND,6494.2,400.0,"AD 2001-06-17, IMPROPER FUEL FLOW SETTINGS CHECK DUE. EFF DATE 4/20/01.",2012-10-22,ADJUSTED MIXTURE & IDLE SETTINGS. NEXT DUE @ 2527.4 TACH.,c_31,mixture adjust mixture control
1116709,2012-10-24 13:23:00,2012-10-24 14:57:00,N570ND,7001.299999999999,7410.0,"ON RUN UP, L/H MAG DROP OF 300 RPM. BURN OFF ATTEMPT FAILED.",2012-10-24,"RAN A/C, LEANED MIXTURE TO CLEAR PLUGS - ATTEMPT UNSUCCESSFUL. NOTED #1 CYL EGT DROPPED. CLEANED BOTH PLUGS FROM #1 CYL. TESTED LEADS, TEST GOOD. REINSTALLED PLUGS & LEADS. MAG CK GOOD.",c_31,mixture adjust mixture control
1116797,2012-10-27 09:45:00,2012-10-27 13:41:00,N525ND,7136.8,7410.0,"WHEN SWITCHING TO L/H MAG, RPM DROPS FROM 1800 TO 1580.",2012-10-27,"RAN A/C, LEANED MIXTURE TO CLEAN FOULING FROM PLUGS, OPS CK GOOD.",c_31,mixture adjust mixture control
1117123,2012-11-05 15:37:00,2012-11-06 11:02:00,N522ND,10888.8,7200.0,"#2 CYL ""MISSING"" ON RUN UP (RUNS ROUGH).",2012-11-06,"RAN, OPS OK. NO ROUGHNESS. EGT - CHT - STATIC RPM - IDLE SPEED & MIXTURE OK.",c_31,mixture adjust mixture control
1117229,2012-11-09 07:01:00,2012-11-09 13:54:00,N558ND,7325.3,400.0,"AD 2001-06-17, IMPROPER FUEL FLOW DUE. EFF DATE 4/20/01.",2012-11-09,"C/W AD BY CK'ING IDLE & MIXTURE RISE - OK, W/IN LIMITS. NEXT DUE @ NEXT SERVO ADJUSTMENT.",c_31,mixture adjust mixture control
1117356,2012-11-14 11:39:00,2012-11-14 12:56:00,N568ND,6336.9,7100.0,ENGINE SHUT DOWN WHEN CHECKING IDLE.,2012-11-14,RAN A/C & ADJUSTED IDLE MIXTURE & RPM FOR OUTSIDE SEASONAL TEMPERATURE. OPS CHECK GOOD.,c_31,mixture adjust mixture control
1117479,2012-11-16 10:06:00,2012-11-16 15:29:00,N538ND,6196.6,7410.0,"AFTER LANDING, ENG RAN A LITTLE ROUGH. INCREASED POWER CAUSING ENG TO FAIL. RESTARTED, SEEMED TO BE RELATED TO TEMP & STUDENT TECHNIQUE SO CONTINUED FLIGHT. LAST LANDING, SAME THING HAPPENED BUT COULD NOT RESTART.",2012-11-16,"OPERATED ENGINE, CK'ED IDLE MIXTURE & IDLE RPM NOTING NO DISCREP. PERFORMED IDLE RPM MAG CK NOTING ENG DOES NOT CONTINUE TO RUN. REMOVED & REPLACED R/H MAG W/ S/N 11081101. OPS/LK CK GOOD. SEE PD #2 FOR LEFT MAG. IDLE OPS CK GOOD.",c_31,mixture adjust mixture control
1117657,2012-11-21 07:03:00,2012-11-21 09:51:00,N564ND,7549.299999999999,7600.0,MIXTURE STICKY.,2012-11-21,CLEANED LUBE MIXTURE CABLE.,c_31,mixture adjust mixture control
1117737,2012-11-26 12:58:00,2012-11-27 14:43:00,N563ND,7558.3,7410.0,BAD MAG DROP.,2012-11-27,"RAN A/C, ADJUSTED MIXTURE & IDLE RPM. OPS CK GOOD.",c_31,mixture adjust mixture control
1117738,2012-11-26 12:58:00,2012-11-26 13:38:00,N557ND,6805.6,7320.0,ENGINE RUNS ROUGH AT LOW RPM.,2012-11-26,"ADJUSTED IDLE & MIXTURE FOR SEASONAL CONDITIONS, NO DEFECTS NOTED.",c_31,mixture adjust mixture control
1117772,2012-11-27 07:02:00,2012-11-28 10:29:00,N525ND,7412.2,7100.0,ENGINE CHANGE DUE.,2012-11-28,"COMPLETED INSTALLATION OF AIRWORTHY COMPONENTS. ROUTED & SECURED IGNITION LEADS, AIR DUCTS & FUEL/OIL LINES. RIGGED THROTTLE & MIXTURE TO SERVO. PREOILED, OPS & LK ENGINE NOTING NO DISCREPS. SEE W/O #1117812 FOR MX FLIGHT.",c_31,mixture adjust mixture control
1117846,2012-11-29 09:54:00,2012-12-07 13:36:00,N605ND,27.900000000000002,400.0,"AD 2001-06-17, FUEL MIXTURE DUE. EFF DATE 4/20/01.",2012-12-06,CHECKED IDLE SPEED & MIXTURE SETTING IAW AD INSTRUCTIONS. CHECKS GOOD. NO FURTHER ACTION REQUIRED.,c_31,mixture adjust mixture control
1117849,2012-11-29 10:25:00,2012-12-01 14:06:00,N563ND,7570.0,7310.0,ENG RUNS ROUGH AT 1700 - 2000 RPM.,2012-11-30,RAN ENGINE & ADJUSTED IDLE MIXTURE - PROBLEM PERSISTS.,c_31,mixture adjust mixture control
1117849,2012-11-29 10:25:00,2012-12-01 14:06:00,N563ND,7570.0,400.0,AD 2001-06-17 DUE. EFF DATE 4/20/01.,2012-11-30,"C/W AD, ADJUSTED MIXTURE & IDLE TO SPECS. NEXT DUE @ 3378.0 TACH.",c_31,mixture adjust mixture control
1117849,2012-11-29 10:25:00,2012-12-01 14:06:00,N563ND,7570.0,7310.0,ENG RUNS ROUGH AT 1700 - 2000 RPM.,2012-11-30,"REMOVED & REPLACED FUEL SERVO W/ S/N 70192903 (CAN TAG #1564). RAN A/C, ADJUSTED MIXTURE & IDLE TO SPECS. ENGINE ROUGHNESS NO LONGER PRESENT. OPS & LEAK CHECK GOOD.",c_31,mixture adjust mixture control
1117857,2012-11-29 13:43:00,2012-11-29 15:31:00,N579ND,6065.4,7610.0,"DURING RUN UP, ENGINE DIED DURING IDLE CK.",2012-11-29,"RAN A/C, ADJUSTED IDLE RPM & MIXTURE, OPS CK GOOD.",c_31,mixture adjust mixture control
1117895,2012-11-30 10:35:00,2012-11-30 15:18:00,N536ND,6944.400000000001,7200.0,NOTICE ENGINE HAD AUDIBLE FLUCTUATIONS ON TAXI & BEFORE TAXI CHECKLIST. NO INCREASE DURING NORMAL LEANING PROCEDURES. ENGINE FLUCTUATED -/-50 RPM @ 1800 RPM. LEANED MIXTRE & NOTHING CHANGED.,2012-11-30,RAN ENGINE & ADJUSTED IDLE SPEED & MIXTURE. OPS CHECK GOOD.,c_31,mixture adjust mixture control
1117951,2012-12-03 14:30:00,2012-12-04 11:02:00,N548ND,5402.700000000001,7610.0,MIXTURE CONTROL @ FUEL SERVO ON I/B SIDE OF ARM.,2012-12-03,DISCONNECTED & REROUTED MIXTURE CONTROL CABLE TO O/B SIDE OF CONTROL ARM. OPS CHECK GOOD.,c_31,mixture adjust mixture control
1117954,2012-12-04 07:03:00,2012-12-04 13:27:00,N563ND,7576.6,7300.0,IDLE MIXTURE RICH.,2012-12-04,OPS CHECK GOOD.,c_31,mixture adjust mixture control
1117954,2012-12-04 07:03:00,2012-12-04 13:27:00,N563ND,7576.6,7300.0,IDLE MIXTURE RICH.,2012-12-04,ADJUSTED IDLE MIXTURE.,c_31,mixture adjust mixture control
1118025,2012-12-05 12:42:00,2012-12-12 14:30:00,N509ND,7507.799999999999,7100.0,ENGINE CHANGE IS DUE.,2012-12-12,"RAN A/C, LEAK CHECK GOOD. SET MIXTURE & IDLE RPM.",c_31,mixture adjust mixture control
1118025,2012-12-05 12:42:00,2012-12-12 14:30:00,N509ND,7507.799999999999,400.0,"AD 2001-06-17, IMPROPER FUEL FLOW SETTINGS DUE. EFF DATE 4/20/01.",2012-12-12,SET MIXTURE & IDLE RPM TO SPECS. NEXT DUE @ 2487.8 TACH.,c_31,mixture adjust mixture control
1118081,2012-12-07 07:35:00,2012-12-13 11:37:00,N603ND,35.400000000000006,400.0,"AD 2001-06-17, IMPROPER FUEL FLOW SETTINGS DUE. EFF DATE 4/20/01.",2012-12-13,CHECKED IDLE RPM & MIXTURE IAW AD INSTRUCTIONS. CHECK GOOD. NO FURTHER ACTION REQUIRED.,c_31,mixture adjust mixture control
1118082,2012-12-07 07:36:00,2012-12-13 11:35:00,N604ND,23.4,400.0,"AD 2001-06-17, IMPROPER FUEL FLOW SETTING DUE. EFF DATE 4/20/01.",2012-12-13,CHECKED IDLE RPM & MIXTURE IAW AD INSTRUCTIONS. CHECK GOOD. NO FURTHER ACTION REQUIRED.,c_31,mixture adjust mixture control
1118171,2012-12-11 06:54:00,2012-12-18 12:42:00,N550ND,7664.400000000001,400.0,"AD 2011-16-17, FUEL INCORRECT FLOW SETTING DUE. EFF DATE 4/20/01.",2012-12-18,ADJUSTED MIXTURE & IDLE TO PROPER RISE & RPMS. NEXT DUE @ 2531.4 TACH.,c_31,mixture adjust mixture control
1118209,2012-12-12 06:59:00,2012-12-15 13:02:00,N570ND,7268.299999999999,7410.0,IDLE SPEED LOW W/ NO MIXTURE RISE.,2012-12-12,ADJUSTED IDLE SPEED & MIXTURE.,c_31,mixture adjust mixture control
1118209,2012-12-12 06:59:00,2012-12-15 13:02:00,N570ND,7268.299999999999,7410.0,IDLE SPEED LOW W/ NO MIXTURE RISE.,2012-12-14,OPS CHECK GOOD.,c_31,mixture adjust mixture control
1118349,2012-12-18 12:34:00,2012-12-18 14:17:00,N539ND,9912.3,400.0,"AD 2001--06-17, IMPROPER FUEL FLOW SETTING DUE. EFF DATE 4/20/01.",2012-12-18,"C/W AD BY RUNNING UP ENG TO OPERATING TEMPS & CK'ING MIXTURE RISE & IDLE, BOTH W/IN LIMITS. OPS CK GOOD.",c_31,mixture adjust mixture control
1118392,2012-12-21 07:27:00,2012-12-28 09:01:00,N526ND,7352.1,7310.0,IDLE SPEED @ 700 W/ 140 RPM RISE.,2012-12-21,ADJUSTED IDLE SPEED & MIXTURE.,c_31,mixture adjust mixture control
1118446,2012-12-28 07:04:00,2012-12-28 10:05:00,N574ND,11734.3,7310.0,IDLE SPEED @ 610 W/ 180 RPM RISE.,2012-12-28,ADJUSTED IDLE SPEED & MIXTURE.,c_31,mixture adjust mixture control
1118472,2012-12-31 07:04:00,2013-01-10 13:40:00,N537ND,7353.0,7100.0,ENGINE DUE TIME CHANGE.,2013-01-10,RAN A/C. SET IDLE RPM & MIXTURE. LEAK & OPS CHECK GOOD. SEE W/O #1118716 FOR MAINTENANCE FLIGHT.,c_31,mixture adjust mixture control
1118472,2012-12-31 07:04:00,2013-01-10 13:40:00,N537ND,7353.0,400.0,"AD 2001-06-17, IMPROPER FUEL FLOW SETTINGS DUE. EFF DATE 4/20/01.",2013-01-10,ADJUSTED IDLE RPM & MIXTURE IAW CESSNA MAINTENANCE MANUAL. NEXT DUE AS REQUIRED.,c_31,mixture adjust mixture control
1118942,2013-01-18 06:58:00,2013-01-18 13:30:00,N546ND,6769.200000000001,7100.0,IDLE & MIXTURE NEED TO BE ADJUSTED FOR SEASONAL TEMPERATURE CONDITIONS.,2013-01-18,OPS CHECK GOOD.,c_31,mixture adjust mixture control
1118942,2013-01-18 06:58:00,2013-01-18 13:30:00,N546ND,6769.200000000001,7100.0,IDLE & MIXTURE NEED TO BE ADJUSTED FOR SEASONAL TEMPERATURE CONDITIONS.,2013-01-18,ADJUSTED MIXTURE & IDLE FOR SEASONAL TEMPERATURE CONDITIONS.,c_31,mixture adjust mixture control
1118946,2013-01-18 09:23:00,2013-01-18 13:44:00,N521ND,6840.9,7610.0,MIXTURE IS NOT HITTING CUT OFF STOP.,2013-01-18,"ADJUSTED MIXTURE RIGGING, OPS CHECKED GOOD.",c_31,mixture adjust mixture control
1119361,2013-01-30 06:45:00,2013-02-07 11:28:00,N536ND,7217.099999999999,7610.0,NO RISE ON IDLE MIXTURE CHECK.,2013-02-07,ADJUSTED MIXTURE FOR SEASONAL CONDITIONS.,c_31,mixture adjust mixture control
1119430,2013-02-01 08:34:00,2013-02-01 14:56:00,N577ND,7752.0,7100.0,"ENGINE SHUT OFF DURING IDLE, AFTER LANDING.",2013-02-01,"RAN A/C & FOUND IDLE MIXTURE TO BE LOW. ADJUSTED MIXTURE TO SPECS FOR SEASONAL TEMPERATURE, OPS CHECK GOOD.",c_31,mixture adjust mixture control
1119455,2013-02-01 14:36:00,2013-02-01 15:15:00,N557ND,7114.6,7400.0,IDLE RPM @ 620 ON HARD STOP W/ 110 RPM RISE.,2013-02-01,ADJUSTED THROTTLE & MIXTURE TO SPECS TO COMPENSATE TEMP. OPS CHECK GOOD.,c_31,mixture adjust mixture control
1119459,2013-02-01 14:50:00,2013-02-01 15:21:00,N565ND,7474.1,7600.0,MIXTURE CABLE BOOT IS TORN.,2013-02-01,REPAIRED BOOT.,c_31,mixture adjust mixture control
1119498,2013-02-03 10:11:00,2013-02-06 14:55:00,N510ND,7481.099999999999,400.0,"AD 2001-06-17, IMPROPER FUEL FLOW SETTINGS DUE. EFF DATE 4/20/01.",2013-02-06,SET IDLE SPEED & IDLE MIXTURE TO SPECS. NEXT DUE @ 2471.8 TACH.,c_31,mixture adjust mixture control
1119498,2013-02-03 10:11:00,2013-02-06 14:55:00,N510ND,7481.099999999999,7200.0,ENGINE DUE TIME CHANGE.,2013-02-06,"REMOVED & REPLACED EGT PROBE STAND OFFS ON #1 & 2 CYL, INSTALLED GROMMET ON #1 CYL FWD BAFFLE. RAN UP ENGINE, SET IDLE SPEED & IDLE MIXTURE. OPS & LEAK CHECK GOOD. COMPLETED LOGBOOK ENTRIES & PAPERWORK.",c_31,mixture adjust mixture control
1119792,2013-02-12 14:43:00,2013-02-12 15:21:00,N513ND,11281.4,7320.0,ENGINE IDLES AT 300 - 400 RPM.,2013-02-12,ADJUSTED IDLE RPM & MIXTURE. IDLE OPS CHECK GOOD.,c_31,mixture adjust mixture control
1119803,2013-02-13 06:22:00,2013-02-15 14:48:00,N540ND,7625.700000000001,7100.0,ENGINE DUE TIME CHANGE.,2013-02-15,"RAN UP A/C, OPS & LEAK CHECK GOOD. SET IDLE RPM & MIXTURE RISE, OPS CHECK GOOD. INSTALLED COWLING. RECORDED ENTRY IN ENGINE LOG BOOK. SEE W/O #1119931 FOR MX FLIGHT.",c_31,mixture adjust mixture control
1119920,2013-02-15 09:13:00,2013-02-19 11:21:00,N577ND,7861.200000000001,400.0,"AD 2001-06-17, IMPROPER FUEL FLOW SETTINGS DUE. EFF DATE 4/20/01.",2013-02-17,"C/W AD, ADJUSTED IDLE SPEED & MIXTURE RISE. NEXT DUE @ 2321.1 TACH.",c_31,mixture adjust mixture control
1120111,2013-02-22 12:48:00,2013-02-22 14:34:00,N517ND,8827.3,7320.0,IDLE IS LOW.,2013-02-22,ADJUSTED IDLE RPM & IDLE MIXTURE.,c_31,mixture adjust mixture control
1120316,2013-03-01 14:44:00,2013-03-02 13:19:00,N513ND,11435.6,7320.0,MIXTURE NEEDS TO BE ENRICHED.,2013-03-01,ENRICHENED MIXTURE.,c_31,mixture adjust mixture control
1120316,2013-03-01 14:44:00,2013-03-02 13:19:00,N513ND,11435.6,7320.0,MIXTURE NEEDS TO BE ENRICHED.,2013-03-02,OPERATIONAL CHECK GOOD.,c_31,mixture adjust mixture control
1120478,2013-03-07 14:34:00,2013-03-07 15:25:00,N579ND,6504.0,7420.0,"ON RUN UP, L/H MAG CHECK, 200 RPM DROP.",2013-03-07,"RAN A/C, LEANED MIXTURE TO CLEAR PLUGS. OPS CHECK GOOD.",c_31,mixture adjust mixture control
1120540,2013-03-10 07:21:00,2013-03-10 13:40:00,N522ND,11711.4,7320.0,ENGINE FAILS TO IDLE.,2013-03-10,"WARMED ENG UP TO TEMP, ADJUSTED IDLE MIXTURE & RPM. IDLE OPS CHECK GOOD.",c_31,mixture adjust mixture control
1120606,2013-03-11 14:25:00,2013-03-11 15:33:00,N570ND,7702.700000000001,7100.0,"3 DIFFERENT TIMES W/ MILD TO MODERATE VIBRATIONS FEELING AS THOUGH LOST PARTICAL POWER. AROUND 3000 FT, 2500 RPM ON APPROACH TO CKN.",2013-03-11,"RAN ENG, ADJUSTED IDLE MIXTURE & RPM. INSPECTED ENGINE NOTING NO DISCREPS. SEE W/O #1120612 FOR MX FLIGHT.",c_31,mixture adjust mixture control
1120638,2013-03-12 12:32:00,2013-03-15 14:37:00,N523ND,4588.0,7720.0,#2 EGT READ HIGH 100 - 150 DEGREES ABOVE OTHER CYLS.,2013-03-13,"DURING ENG RUN WHEN MIXTURE IS LEANED, #2 CYL GOES COLD BEFORE 1, 3 & 4, INDICATING #2 FUEL RESTRICTION.INSTALLED FLOW DIVIDER & #2 FUEL LINE FROM CORE ENGINE. PROBLEM PERSISTS.",c_31,mixture adjust mixture control
1120768,2013-03-17 14:28:00,2013-03-19 14:01:00,N572ND,7245.3,7300.0,NO RPM RISE WHEN MIXTURE IS LEANED AT IDLE.,2013-03-19,OPS CHECK GOOD.,c_31,mixture adjust mixture control
1120768,2013-03-17 14:28:00,2013-03-19 14:01:00,N572ND,7245.3,7300.0,NO RPM RISE WHEN MIXTURE IS LEANED AT IDLE.,2013-03-19,ADJUSTED IDLE MIXTURE.,c_31,mixture adjust mixture control
1121127,2013-03-26 18:55:00,2013-03-28 14:53:00,N508ND,6457.5,7610.0,IDLE MIXTURE IS TOO RICH.,2013-03-28,ADJUSTED IDLE MIXTURE DUE TO SEASONAL CHANGE.,c_31,mixture adjust mixture control
1121344,2013-04-02 14:56:00,2013-07-26 15:19:00,N522ND,11961.6,7310.0,"NO RPM RISE DURING MIXTURE CHECK, NEEDS TO BE ADJUSTED.",2013-07-26,"RAN A/C, IDLE MIXTURE CK GOOD.",c_31,mixture adjust mixture control
1121539,2013-04-09 15:01:00,2013-04-10 13:39:00,N519ND,8503.9,7310.0,IDLE @ 530 RPM W/ 60 RPM RISE.,2013-04-09,ADJUSTED IDLE SPEED & MIXTURE.,c_31,mixture adjust mixture control
1121593,2013-04-10 16:44:00,2013-04-12 14:26:00,N523ND,4837.3,7200.0,A/C DIED DURING IDLE CK.,2013-04-10,"RAN A/C, ATTEMPTED TO ADJUST IDLE MIXTURE TO CORRECT 300 RPM IDLE RISE & FOUND THAT IT WOULDN'T GO DOWN W/ LEAN ADJUSTMENTS.",c_31,mixture adjust mixture control
1121593,2013-04-10 16:44:00,2013-04-12 14:26:00,N523ND,4837.3,7200.0,A/C DIED DURING IDLE CK.,2013-04-12,REMOVED & REPLACED FUEL SERVO W/ S/N 70AD7610. RAN A/C & ADJUSTED MIXTURE & THROTTLE TO SPECS.,c_31,mixture adjust mixture control
1121739,2013-04-17 06:47:00,2013-04-17 11:24:00,N526ND,8097.3,7610.0,IDLE MIXTURE RISE IS LOW.,2013-04-17,ADJUSTED MIXTURE TO SPECS.,c_31,mixture adjust mixture control
1121817,2013-04-19 13:04:00,2013-04-19 13:54:00,N568ND,7241.700000000001,7200.0,"WHILE ADJUSTING MIXTURE, A/C WOULD START TO QUIT @ 1450.",2013-04-19,PERFORMED ENGINE RUN. COULD NOT DUPLICATE. NO DEFECTS NOTED.,c_31,mixture adjust mixture control
1121938,2013-04-23 07:15:00,2013-04-23 10:48:00,N545ND,8538.8,7410.0,"ON RUN UP, R/H MAG RPM QUICKLY DROPPED 250 RPM.",2013-04-23,"RAN A/C, LEANED MIXTURE TO CLEAN FOULING FROM PLUGS. MAG CK GOOD.",c_31,mixture adjust mixture control
1122083,2013-04-27 10:40:00,2013-04-29 13:54:00,N563ND,8367.1,7610.0,NO IDLE RISE AT IDLE CUT OFF.,2013-04-27,ADJUSTED MIXTURE.,c_31,mixture adjust mixture control
1122114,2013-04-29 06:52:00,2013-04-29 13:22:00,N516ND,11996.6,7600.0,MIXTURE CONTROL WORKS HARD.,2013-04-29,LUBED MIXTURE CONTROL.,c_31,mixture adjust mixture control
1122115,2013-04-29 07:01:00,2013-04-29 10:40:00,N514ND,12980.3,7310.0,IDLE RPM LOW W/ 140 RPM RISE. IDLE @ 380 RPM.,2013-04-29,ADJUSTED IDLE SP & MIXTURE.,c_31,mixture adjust mixture control
1122210,2013-05-01 06:51:00,2013-05-02 11:15:00,N546ND,7520.099999999999,7100.0,ENG CHANGE DUE.,2013-05-02,"COMPLETED ENGINE INSTALLATION. PRE-OILED, RAN A/C, SET IDLE & MIXTURE. OPS & LEAK CK GOOD. SEE W/O #1122274 FOR MAINTENANCE FLIGHT.",c_31,mixture adjust mixture control
1122309,2013-05-03 06:47:00,2013-05-03 15:17:00,N570ND,8202.2,7100.0,IDLE RPM IS HIGH & NO RISE ON IDLE MIXTURE CHECK.,2013-05-03,ADJUSTED IDLE RPM & MIXTURE RISE TO SPECS FOR SEASONAL CONDITIONS.,c_31,mixture adjust mixture control
1122317,2013-05-03 10:19:00,2013-05-10 10:17:00,N606ND,29.400000000000002,400.0,"AD 2001-06-17, IMPROPER FUEL FLOW SETTINGS DUE. EFF DATE 4/20/01.",2013-05-09,"CHECKED IDLE RPM & IDLE MIXTURE IAW AD, SETTINGS CHECK GOOD. NO ADJUSTMENT REQUIRED.",c_31,mixture adjust mixture control
1122479,2013-05-08 07:45:00,2013-05-08 13:51:00,N570ND,8224.1,7600.0,"DURING ENGINE IDLE, ENGINE WANTS TO DIE.",2013-05-08,RAN UP A/C TO OPERATING TEMPS. SET IDLE SPEED TO SPECS.OPS CHECK GOOD. IDLE MIXTURE CHECK GOOD.,c_31,mixture adjust mixture control
1122516,2013-05-09 07:00:00,2013-05-09 13:45:00,N507ND,7188.900000000001,7200.0,"AFTER PERFORMING SIMULATED ENGINE FAILURE, SMOOTHLY APPLIED FULL POWER & CLIMBED OUT. ABOUT 15 SEC AFTER, ENGINE VIBRATED & ENGINE RPM DECREASED FROM 2500 TO 2350. ENGINE REMAINED OK.",2013-05-09,"RAN UP A/C ENGINE. ENGINE RUNS SMOOTH. MAG DROPS, IDLE MIXTURE & SPEED ALL OPS CHECK GOOD. SEE W/O #1122518 FOR MAINTENANCE FLIGHT.",c_31,mixture adjust mixture control
1122565,2013-05-10 10:03:00,2013-05-10 11:12:00,N572ND,7694.700000000001,7410.0,"L/H MAG DROPPED 170 RPM & R/H MAG DROPPED 70 RPM IN LEANED MIXTURE & BURNED, DIFFERENCE BETWEEN 2 MAGS STILL EXCEED 50 RPM.",2013-05-10,"RESET L/H & R/H MAG EXTERNAL TIMING, PROBLEM PERSISTS. REMOVED & REPLACED L/H MAG W/ S/N 12080219. PERFORMED GROUND RUN, OPS CHECKED GOOD IAW LYCOMING OPERATORS MANUAL SEC 3. LEAK CHECKED GOOD.",c_31,mixture adjust mixture control
1122880,2013-05-20 07:13:00,2013-05-20 10:18:00,N511ND,8243.6,7610.0,SEASONAL IDLE ADJUSTMENT NEEDED.,2013-05-20,"ADJUSTED MIXTURE SETTING, OPS CHECKED GOOD.",c_31,mixture adjust mixture control
1123061,2013-05-24 06:55:00,2013-05-24 13:46:00,N516ND,12247.4,8010.0,NO START.,2013-05-24,"STARTED ENGINE, PERFORMED SEASONAL IDLE & MIXTURE ADJUSTMENT. OPS CHECKED GOOD.",c_31,mixture adjust mixture control
1123114,2013-05-26 07:51:00,2013-05-26 13:09:00,N528ND,8751.1,7410.0,RUN UP LEFT MAG DROPPED 210 RPM.,2013-05-26,"RAN A/C, LEANED MIXTURE IAW LYCOMING OPERATORS MANUAL. MAG DROP W/IN SPECS.",c_31,mixture adjust mixture control
1123336,2013-06-03 07:01:00,2013-06-03 10:40:00,N527ND,6511.9,7310.0,ENGINE IDLES @ 540 W/ 140 RPM RISE.,2013-06-03,ADJUSTED IDLE SPEED & MIXTURE.,c_31,mixture adjust mixture control
1123550,2013-06-07 11:25:00,2013-06-21 14:19:00,N603ND,874.1999999999999,7200.0,ENGINE DIES AT IDLE SETTING.,2013-06-21,CHECKED TIMING. ADJUSTED FUEL CONTROL MIXTURE & IDLE. RESEATED #4 EXHAUST RISER IN MUFFLER.,c_31,mixture adjust mixture control
1123569,2013-06-08 09:51:00,2013-06-08 14:35:00,N566ND,9066.8,7320.0,"ON ENGINE RUN UP IDLE MIXTURE CHECK, RPM RISE WAS ABOUT 100 RPM.",2013-06-08,"ADJUSTED IDLE SPEED & MIXTURE ADJUSTMENTS, IDLE MIXTURE CHECK GOOD. SEASONAL ADJUSTMENT.",c_31,mixture adjust mixture control
1123611,2013-06-10 07:05:00,2013-06-10 10:14:00,N565ND,8563.7,7610.0,NO RISE ON MIXTURE SETTING.,2013-06-10,OPS CK GOOD.,c_31,mixture adjust mixture control
1123611,2013-06-10 07:05:00,2013-06-10 10:14:00,N565ND,8563.7,7610.0,NO RISE ON MIXTURE SETTING.,2013-06-10,ADJUSTED MIXTURE.,c_31,mixture adjust mixture control
1123807,2013-06-15 08:23:00,2013-06-15 12:38:00,N556ND,8581.2,7610.0,MIXTURE REQ RISE.,2013-06-15,OPS CK GOOD.,c_31,mixture adjust mixture control
1123807,2013-06-15 08:23:00,2013-06-15 12:38:00,N556ND,8581.2,7610.0,MIXTURE REQ RISE.,2013-06-15,ADJUSTED MIXTURE.,c_31,mixture adjust mixture control
1123816,2013-06-15 17:35:00,2013-06-16 15:15:00,N546ND,7629.299999999999,400.0,"AD 2001-06-17, IMPROPER FUEL FLOW SETTINGS DUE. EFF DATE 4/20/01.",2013-06-16,"C/W AD, ADJUSTED IDLE RPM & MIXTURE PER AD. NO DEFECTS NOTED. NEXT DUE @ 2606.7 TACH.",c_31,mixture adjust mixture control
1123974,2013-06-19 14:46:00,2013-06-19 15:12:00,N564ND,9060.4,7610.0,MIXTURE CABLE BOOT IS TORN.,2013-06-19,REMOVED CABLE & ROD END FABRICATED & INSTALLED NEW BOOT. REINSTALLED CABLE & ROD END. TRAVEL CK GOOD.,c_31,mixture adjust mixture control
1124003,2013-06-20 14:09:00,2013-07-12 13:53:00,N558ND,9017.9,7610.0,IDLE MIXTURE RISE IS TOO HIGH.,2013-06-20,OPS CHECK GOOD.,c_31,mixture adjust mixture control
1124003,2013-06-20 14:09:00,2013-07-12 13:53:00,N558ND,9017.9,7610.0,IDLE MIXTURE RISE IS TOO HIGH.,2013-06-20,ADJUSTED MIXTURE.,c_31,mixture adjust mixture control
1124016,2013-06-21 10:57:00,2013-06-21 15:26:00,N515ND,9379.0,7410.0,MAG DROP WAS EXCESSIVE.,2013-06-21,LEANED MIXTURE IAW LYCOMING OPERATORS MANUAL. OPS CHECK GOOD.,c_31,mixture adjust mixture control
1124020,2013-06-21 12:06:00,2013-06-21 12:35:00,N509ND,8543.2,7320.0,A/C IDLE IS LOW.,2013-06-21,"RAN A/C, ADJUSTED MIXTURE & IDLE SETTING TO MANUFACTURERS SPECS. OPS CHECK GOOD.",c_31,mixture adjust mixture control
1124020,2013-06-21 12:06:00,2013-06-21 12:35:00,N509ND,8543.2,7320.0,A/C IDLE IS LOW.,2013-06-21,"C/W AD 2001-06-17, IMPROPER FUEL FLOW SETTING (EFF DATE 4/20/01). INSPECTED IDLE SETTING & FUEL MIXTURE. ADJUSTED TO SPECS. NEXT DUE @ 2995.3 TACH.",c_31,mixture adjust mixture control
1124042,2013-06-21 20:46:00,2013-06-22 13:20:00,N579ND,7399.200000000001,7100.0,ENGINE IDLED AT 890 RPM.,2013-06-22,ADJUSTED IDLE & MIXTURE FOR SEASONAL TEMPERATURE CONDITION. OPS CHECK GOOD.,c_31,mixture adjust mixture control
1124310,2013-06-30 11:53:00,2013-06-30 13:03:00,N514ND,13574.0,7310.0,"ON RUN UP CHECKLIST, ENGINE WILL DIE AT IDLE.",2013-06-30,RAN ENGINE & ADJUSTED IDLE SPEED & MIXTURE. OPS CHECK GOOD. ADJUSTMENT DETERMINED TO BE SEASONAL DUE TO WARMER TEMPS THIS DAY.,c_31,mixture adjust mixture control
1124441,2013-07-03 12:32:00,2013-07-03 14:41:00,N523ND,5661.4,7320.0,ENG FAILS TO IDLE.,2013-07-03,REFORMED SEASONAL RPM & MIXTURE ADJUSTMENT. IDLE OPS CHECK GOOD.,c_31,mixture adjust mixture control
1124614,2013-07-11 07:13:00,2013-07-26 10:14:00,N543ND,7829.400000000001,7100.0,ENGINE TIMED OUT.,2013-07-15,"COMPLETED ENGINE INSTALLATION. RAN ENGINE, SET IDLE & MIXTURE. OPS & LEAK CHECK GOOD. MAINTENANCE FLIGHT ON W/O #1124749.",c_31,mixture adjust mixture control
1124970,2013-07-23 07:16:00,2013-07-24 13:01:00,N524ND,8540.9,7310.0,ENGINE RUNNING LEAN AT 1800 RPM.,2013-07-23,"REMOVED, CLEANED & FLOW CHECK FUEL NOZZLES. OPS & LEAK CK GOOD. REMOVED & REPLACED FUEL SERVO W/ S/N 70773202. RAN UP A/C, NEW FUEL SERVO WAS RUNNING TOO RICH. ADJUSTED MIXTURE, COULD NOT BRING INTO RANGE.",c_31,mixture adjust mixture control
1124970,2013-07-23 07:16:00,2013-07-24 13:01:00,N524ND,8540.9,7310.0,ENGINE RUNNING LEAN AT 1800 RPM.,2013-07-24,"RAN UP A/C, ADJUSTED MIXTURE & IDLE TO SPECS. OPS & LEAK CK GOOD. RAN A/C., FILLED OUT SERVO DATA SHEET.",c_31,mixture adjust mixture control
1125100,2013-07-29 06:55:00,2013-07-29 10:27:00,N549ND,6382.9,7300.0,NO MIXTURE RISE.,2013-07-29,"ADJUSTED MIXTURE, CONSIDERED TO BE SEASON ADJUSTMENT. OPS CK GOOD.",c_31,mixture adjust mixture control
1125233,2013-08-01 06:15:00,2013-08-01 11:09:00,N546ND,8009.1,7320.0,NO RISE ON MIXTURE SETTING.,2013-08-01,OPS CK GOOD.,c_31,mixture adjust mixture control
1125233,2013-08-01 06:15:00,2013-08-01 11:09:00,N546ND,8009.1,7320.0,NO RISE ON MIXTURE SETTING.,2013-08-01,ADJUSTED MIXTURE SETTINGS.,c_31,mixture adjust mixture control
