workorder,date_time_opened,date_time_closed,registration,total_time,ata_code,problem,date,action,cluster,cluster_name
1137044,2014-09-10 13:55:00,2014-09-16 10:31:00,N633ND,3427.7999999999997,520.0,CESSNA PHASE 1 DUE.,2014-09-16,ADJUSTED FUEL CONTROL.,c_31,mixture adjust mixture control
1137202,2014-09-15 16:46:00,2014-09-16 13:49:00,N561ND,8318.1,7600.0,THROTTLE & MIXTURE ROD END BOLTS ARE TOO LOOSE.,2014-09-16,TIGHTENED & RECOTTER PINNED.,c_31,mixture adjust mixture control
1137294,2014-09-17 17:24:00,2014-09-22 13:26:00,N532ND,9177.3,400.0,"AD 2001-06-17, IMPROPER FUEL FLOW SETTINGS DUE. EFF DATE 4/20/01.",2014-09-22,"RAN A/C, IDLE RPM & MIXTURE CK'ED GOOD. NEXT DUE @ 2475.0 TACH.",c_31,mixture adjust mixture control
1137311,2014-09-18 14:36:00,2014-09-22 13:13:00,N545ND,12618.800000000001,7200.0,ENGINE REQUIRES TIME CHANGE.,2014-09-19,INSTALLED EXHAUST SYSTEM. CONNECTED ELECTRICAL WIRING. INSTALLED SERVO & INDUCTION AIR ELBOW & SAFETIED. CONNECTED THROTTLE & MIXTURE CABLES & BRACKETS AND SAFETIED. INSTALLED FUEL & OIL LINES.,c_31,mixture adjust mixture control
1137329,2014-09-19 07:05:00,2014-09-29 11:22:00,N606ND,3615.2999999999997,520.0,CESSNA PHASE 2 DUE.,2014-09-29,ADJUSTED FUEL CONTROL.,c_31,mixture adjust mixture control
1137342,2014-09-19 11:08:00,2014-09-23 16:10:00,N605ND,4150.799999999999,520.0,CESSNA PHASE 3 DUE.,2014-09-23,ADJUSTED FUEL CONTROL.,c_31,mixture adjust mixture control
1137516,2014-09-24 06:54:00,2014-09-24 10:04:00,N550ND,11985.1,7100.0,ENGINE RAN ROUGH.,2014-09-24,"RAN A/C, CLEARED ROUGH CYLINDER BY LEANING MIXTURE.",c_31,mixture adjust mixture control
1137681,2014-09-29 09:40:00,2014-09-29 14:50:00,N608ND,2443.8,7610.0,"ON ROLLOUT FROM LANDING, ENGINE DIED. TRIED HOT & FLOODED RESTART. ENGINE WOULD FIRE, BUT NO RESTART.",2014-09-29,STARTED A/C MULTIPLE TIMES. IDLE MIXTURE CK'ED GOOD. OPS CK GOOD.,c_31,mixture adjust mixture control
1137831,2014-10-03 07:27:00,2014-10-13 10:51:00,N633ND,3629.7000000000003,520.0,CESSNA PHASE 2 DUE.,2014-10-13,ADJUSTED FUEL CONTROL.,c_31,mixture adjust mixture control
1137860,2014-10-04 16:52:00,2014-10-13 10:47:00,N634ND,3596.3999999999996,520.0,CESSNA PHASE 2 DUE.,2014-10-13,ADJUSTED FUEL CONTROL.,c_31,mixture adjust mixture control
1137874,2014-10-06 08:38:00,2014-10-09 11:30:00,N551ND,12902.300000000001,400.0,"AD 2001-06-17, IMPROPER FUEL FLOW SETTINGS DUE. EFF DATE 4/20/01.",2014-10-09,"C/W AD, ADJUSTED IDLE & MIXTURE TO SPECS. NEXT DUE @ 5124.1 TACH.",c_31,mixture adjust mixture control
1138000,2014-10-09 07:06:00,2014-10-09 15:22:00,N560ND,6926.1,7410.0,L/H MAG FAILED CK.,2014-10-09,"RAN A/C, LEANED MIXTURE TO CLEAR FOULING FROM PLUGS. MAGS CK GOOD.",c_31,mixture adjust mixture control
1138012,2014-10-09 08:48:00,2014-10-16 13:33:00,N577ND,5296.0,7200.0,ROUGH RUNNING ENGINE ON START UP.,2014-10-16,"PERFORMED GROUND RUN, CK'ED MAG DROP & MIXTURE SETTINGS, ALL ENGINE FUNCTIONS NORMAL.",c_31,mixture adjust mixture control
1138072,2014-10-11 10:53:00,2014-10-16 13:21:00,N605ND,4332.6,520.0,CESSNA PHASE 4 DUE.,2014-10-16,ADJUSTED FUEL CONTROL.,c_31,mixture adjust mixture control
1138085,2014-10-12 14:34:00,2014-10-12 16:00:00,N515ND,13116.099999999999,7200.0,"NEAR IDLE, ENGINE WAS A LITTLE ROUGH. AT STOP FOR RUN UP, RPM DROPPED PASSED 1100, THEN ENGINE SHUT DOWN. POSSIBLE MIXTURE WAS TOO LEAN, BUT MULTIPLE RESTARTS FAILED.",2014-10-12,"STARTED ENGINE, WARMED TO OPERATING TEMPS. ENGINE IDLE SPEED & MIXTURE CK GOOD. MAG DROPS CK GOOD. ENGINE RAN SMOOTH. COULD NOT DUPLICATE DISCREP. CHECKS GOOD AT THIS TIME.",c_31,mixture adjust mixture control
1138187,2014-10-15 06:36:00,2014-10-15 14:41:00,N529ND,16152.7,7610.0,"ON RUN UP, NO RPM RISE ON IDLE CUT OFF.",2014-10-15,"ADJUSTED MIXTURE, RUN UP CK GOOD.",c_31,mixture adjust mixture control
1138192,2014-10-15 09:29:00,2014-10-16 13:02:00,N519ND,12555.1,400.0,"AD 2001-06-17, IMPROPER FUEL FLOW SETTINGS DUE. EFF DATE 4/20/01.",2014-10-16,"RAN A/C, SET IDLE MIXTURE & RPM TO SPECS. NEXT DUE @ 4974.3 TACH.",c_31,mixture adjust mixture control
1138213,2014-10-15 13:59:00,2014-10-23 14:16:00,N603ND,4521.9,520.0,CESSNA PHASE 1 DUE.,2014-10-23,ADJUSTED FUEL CONTROL.,c_31,mixture adjust mixture control
1138466,2014-10-23 12:12:00,2014-10-23 14:06:00,N526ND,12411.4,550.0,"DURING SHUTDOWN CHECKLIST, THROTTLE WAS BROUGHT TO IDLE & ENGINE RAN VERY ROUGH W/ SIGNIFICANT VIBRATION. RPM'S DROPPED TO AROUND 350 AT WORST.",2014-10-23,PERFORMED SEASONAL ADJUSTMENT OF IDLE SPEED & MIXTURE. OPS CK GOOD.,c_31,mixture adjust mixture control
1138488,2014-10-23 22:27:00,2014-10-24 15:00:00,N515ND,13223.2,7610.0,"COLD START WENT FINE, HOT START TOOK ABOUT 5 TIMES TO START, ABOUT 15 MINUTES.",2014-10-23,RAN A/C & CONFIRMED DISCREPANCY. FOUND IDLE TO BE SPORADIC FROM 150 MIXTURE RISE RUNNING ROUGH TO SMOOTH W/ LITTLE RISE. PLUG HARD STARTING.,c_31,mixture adjust mixture control
1138488,2014-10-23 22:27:00,2014-10-24 15:00:00,N515ND,13223.2,400.0,"AD 2001-06-17, IMPROPER FUEL FLOW DUE. EFF DATE 4/20/01.",2014-10-24,"RAN A/C, SET IDLE RPM & MIXTURE TO SPECS. NEXT DUE @ 1892.4 TACH.",c_31,mixture adjust mixture control
1138534,2014-10-25 12:02:00,2014-10-25 12:46:00,N515ND,13229.2,7610.0,IDLE MIXTURE RISE IS EXCESSIVE.,2014-10-25,"RAN A/C, ADJUSTED IDLE RPM & MIXTURE TO SPECS.",c_31,mixture adjust mixture control
1138619,2014-10-28 13:44:00,2014-10-29 14:33:00,N687ND,87.0,561.0,L/H ENGINE MIXTURE ROD END LOOSE.,2014-10-28,TIGHTENED ROD END & SAFETIED W/ NEW COTTER PIN.,c_31,mixture adjust mixture control
1138716,2014-10-31 09:36:00,2014-11-04 14:13:00,N576ND,10819.099999999999,7100.0,"ENGINE CUT OUT ON TAKEOFF, FOLLOWED BY SLIGHT ENGINE VIBRATION.",2014-11-04,"PERFORMED SEASONAL ADJUSTMENTS ON IDLE SPEED & MIXTURE. RAN UP A/C, OPS CK OK.",c_31,mixture adjust mixture control
1138717,2014-10-31 09:44:00,2014-10-31 13:15:00,N545ND,12648.4,7610.0,MIXTURE ROD END BOLT LOOSE.,2014-10-31,TIGHTENED MIXTURE ROD END.,c_31,mixture adjust mixture control
1138752,2014-11-03 06:59:00,2014-11-03 15:31:00,N566ND,12372.8,400.0,"AD 2001-06-17, IMPROPER FUEL FLOW DUE. EFF DATE 4/20/01.",2014-11-03,"RAN, ADJUSTED IDLE MIXTURE & RPM IAW AMM 73-00-01 PARA 7. IDLE OPS CK GOOD IAW AMOC. NEXT DUE @ 4932.7 TACH.",c_31,mixture adjust mixture control
1138851,2014-11-06 13:37:00,2014-11-09 12:54:00,N563ND,12229.7,7610.0,MIXTURE ROD END BOLT LOOSE.,2014-11-06,"TIGHTENED, SECURED MIXTURE ROD END BOLT.",c_31,mixture adjust mixture control
1138865,2014-11-07 06:28:00,2014-11-07 11:28:00,N564ND,12416.8,7610.0,MIXTURE CABLE CLAMP MISSING.,2014-11-07,SAFETIED MIXTURE CABLE SHEATH.,c_31,mixture adjust mixture control
1138904,2014-11-10 06:49:00,2014-11-10 13:09:00,N516ND,9786.3,7320.0,"PRIOR TO ENGINE START, MIXTURE KNOB WAS TOO STICKY TO MOVE COMFORTABLY.",2014-11-10,"REMOVED COWLING, INSPECTED MIXTURE CABLE - OK. LUBRICATED MIXTURE CABLE, OPS CK OK. REINSTALLED COWLING.",c_31,mixture adjust mixture control
1138919,2014-11-10 07:44:00,2014-11-19 11:03:00,N604ND,1479.5,520.0,CESSNA PHASE 1 DUE.,2014-11-19,ADJUSTED FUEL CONTROL.,c_31,mixture adjust mixture control
1139292,2014-11-21 09:48:00,2014-11-21 10:51:00,N557ND,11875.900000000001,7300.0,"AFTER LANDING, ENGINE SPUTTERED & QUIT. TOOK MULTIPLE STARTING ATTEMPTS. AFTER RESTART, VERY NOTICEABLE ENGINE ROUGHNESS.",2014-11-21,PERFORMED SEASONAL ADJUSTMENT OF IDLE SPEED & MIXTURE IAW SPECS IN 172 AMM 73-00-01 PAR 7. OPS CK GOOD. ENGINE RESTARTED CONSISTENTLY ON SEVERAL ATTEMPTS.,c_31,mixture adjust mixture control
1139540,2014-12-02 11:33:00,2014-12-04 11:26:00,N567ND,13012.099999999999,8010.0,"AFTER BEING PULLED FROM HANGAR, COULD NOT START A/C.",2014-12-04,REMOVED & REPLACED FUEL INJ SERVO W/ S/N 70D85507. ADJUSTED ENGINE IDLE & MIXTURE IAW AD 2001-06-17 - SEE PD #2. OPS & LEAK CK GOOD.,c_31,mixture adjust mixture control
1139548,2014-12-02 13:55:00,2014-12-02 14:12:00,N564ND,12591.1,400.0,"AD 2001-06-17, IMPROPER FUEL FLOW SETTINGS DUE. EFF DATE 4/20/01.",2014-12-02,"C/W AD, NO FURTHER ACTION REQUIRED. IDLE & MIXTURE WERE W/IN LIMITS.",c_31,mixture adjust mixture control
1139569,2014-12-03 06:05:00,2014-12-03 14:28:00,N652ND,892.5,7610.0,"MIXTURE PLACED AT ICO, ENGINE DID NOT SHUT OFF RIGHT AWAY & TRIED TO RESTART. HAD TO SHUT ENG DOWN BY PULLING KEYS.",2014-12-03,RAN A/C & PULLED MIXTURE TO ICO SEVERAL TIMES. OPS CK GOOD.,c_31,mixture adjust mixture control
1139613,2014-12-04 06:19:00,2014-12-08 10:23:00,N568ND,11507.1,7610.0,MIXTURE CONTROL BASE NUT LOOSE.,2014-12-04,TIGHTENED MIXTURE CONTROL BASE NUT & VERIFIED TRAVEL LIMITS. OPS CK GOOD.,c_31,mixture adjust mixture control
1139642,2014-12-04 16:17:00,2014-12-11 14:07:00,N560ND,7371.9,7300.0,SEASONAL ADJUSTMENTS NEED TO BE MADE ON IDLE SPEED & MIXTURE.,2014-12-11,"PERFORMED SEASONAL ADJUSTMENT ON IDLE SPEED & MIXTURE, OPS CK GOOD.",c_31,mixture adjust mixture control
1139699,2014-12-06 14:36:00,2015-01-13 10:53:00,N531ND,10515.1,520.0,PHASE 3 DUE.,2015-01-13,ADJUSTED FUEL CONTROL.,c_31,mixture adjust mixture control
1139832,2014-12-15 06:08:00,2014-12-15 11:43:00,N569ND,14877.7,400.0,"AD 2001-06-17, IMPROPER FUEL FLOW DUE. EFF DATE 4/20/01.",2014-12-15,SET IDLE RPM & MIXTURE. OPS CK GOOD. NEXT DUE @ 4104.1 TACH.,c_31,mixture adjust mixture control
1140053,2014-12-29 15:51:00,2015-01-16 14:29:00,N566ND,12690.2,7200.0,ENGINE DUE TIME CHANGE.,2015-01-14,"INSTALLED ENGINE S/N L33361-51E TO A/C USING NEW MOUNTS & TORQUED. INSTALLED FUEL SERVO, FUEL LINES & CONTROLS. RIGGED THROTTLE & MIXTURE. INSTALLED P-LEADS, OIL PRESS SWITCH & OIL PRESS TRANSDUCER. BEGAN INSTALLING BAFFLING. INSTALLED CHT FITTINGS.",c_31,mixture adjust mixture control
1140053,2014-12-29 15:51:00,2015-01-16 14:29:00,N566ND,12690.2,400.0,"AD 2001-06-17, IMPROPER FUEL FLOW SETTINGS DUE. EFF DATE 4/20/01.",2015-01-16,ADJUSTED IDLE SPEED & MIXTURE TO SPECS IAW AD. NEXT DUE @ 5038.5 TACH.,c_31,mixture adjust mixture control
1140057,2014-12-29 16:16:00,2015-01-12 11:03:00,N510ND,4722.7,7600.0,MIXTURE CONTROL ROD END IMPROPER INSTALL.,2014-12-31,INSTALLED ROD END PROPERLY.,c_31,mixture adjust mixture control
1140258,2015-01-11 07:52:00,2015-01-11 11:01:00,N512ND,7030.299999999999,7720.0,"ON FINAL APPROACH, CHT 2 WAS READING 535*F. OCCURRED WHEN MIXTURE RICH & NORMAL RPM RANGE 1800-2500 AFTER ABOUT 1 MIN OF LOW RPM CHT WENT BACK DOWN TO ABOUT 300*F.",2015-01-11,"REMOVED & REPLACED CHT PROBE. RAN A/C, OPS CK GOOD.",c_31,mixture adjust mixture control
1140547,2015-01-20 15:12:00,2015-01-22 10:12:00,N568ND,11596.2,400.0,"AD 2001-06-17, IMPROPER FUEL FLOW DUE. EFF DATE 4/20/01.",2015-01-21,"INSTALLED NEW INJECTOR. RAN A/C, SET IDLE RPM & MIXTURE. NEXT DUE @ 4933.3 TACH.",c_31,mixture adjust mixture control
1140605,2015-01-22 06:09:00,2015-01-23 10:51:00,N655ND,1053.6,7610.0,IDLE SPEED & MIXTURE NEED TO BE ADJUSTED.,2015-01-22,READJUSTED IDLE SPEED & MIXTURE.,c_31,mixture adjust mixture control
1140605,2015-01-22 06:09:00,2015-01-23 10:51:00,N655ND,1053.6,7610.0,IDLE SPEED & MIXTURE NEED TO BE ADJUSTED.,2015-01-23,OPS CK GOOD.,c_31,mixture adjust mixture control
1140729,2015-01-26 08:15:00,2015-02-05 13:01:00,N543ND,12229.6,7320.0,IDLE MIXTURE RICH.,2015-02-05,ADJUSTED FUEL CONTROL.,c_31,mixture adjust mixture control
1140814,2015-01-28 15:14:00,2015-01-30 10:24:00,N571ND,12480.6,7100.0,ENGINE CHANGE DUE.,2015-01-30,"INSTALLED OVERHAULED ENGINE ON A/C. TORQUED MOUNT BOLTS. HOOKED UP ALL HOSES, LINES & WIRING. HOOKED UP THROTTLE & MIXTURE CABLES TO FUEL INJ. TIGHTENED HARDWARE & SAFETIED. INSTALLED MUFFLER & HOOKED UP CHT & EGT PROBES. SERVICED ENG W/ 8 QTS MINERAL OIL",c_31,mixture adjust mixture control
1140847,2015-01-30 08:09:00,2015-02-11 13:27:00,N532ND,13153.2,7310.0,EXCESSIVE RICH IDLE MIXTURE.,2015-02-11,ADJUSTED FUEL CONTROL.,c_31,mixture adjust mixture control
1140881,2015-01-31 13:50:00,2015-02-01 10:37:00,N687ND,356.5,7310.0,L/H & R/H ENGINES WOULDN'T START.,2015-02-01,"ADJUSTED IDLE SPEED & MIXTURE, BOTH ENGINES, CHECK OK.",c_31,mixture adjust mixture control
1140882,2015-01-31 13:56:00,2015-02-01 14:50:00,N564ND,7332.6,7320.0,UPON ENGINE START UP: ENGINE VIBRATED & HEARD GRINDING SOUND. MAG CK WAS GOOD.,2015-01-31,"PERFORMED GROUND RUN, VERIFIED DISCREP. TRIED TO ADJUST IDLE & MIXTURE; MIXTURE SETTING WOULD NOT ADJUST. REMOVED & BEGAN REPLACEMENT OF FUEL INJ W/ S/N 70DB1303. INSTALLED SERVO TO SUMP, CONNECTED FUEL LINES. REINSTALLED CONTROL CABLE MOUNTS & SECURED.",c_31,mixture adjust mixture control
1140882,2015-01-31 13:56:00,2015-02-01 14:50:00,N564ND,7332.6,7320.0,UPON ENGINE START UP: ENGINE VIBRATED & HEARD GRINDING SOUND. MAG CK WAS GOOD.,2015-02-01,"COMPLETED INSTALL W/ MIXTURE CABLE CONTROL ADJUSTED FOR PROPER CONTACT. THROTTLE CONTROL ADJUSTED FOR CORRECT TRAVELS. LEAK CK GOOD. ADJUSTED RPM. IDLE, MIXTURE OK. AD 2001-06-17 EFF DATE 4/20/01 IMPROPER FUEL FLOW DUE @ 5008.5 TACH.",c_31,mixture adjust mixture control
1141006,2015-02-03 07:05:00,2015-02-03 13:31:00,N546ND,11926.2,7100.0,"STARTED RUN UP W/ FULL RICH MIXTURE & LEFT MAGNETO TESTED OK. RIGHT MAG DROP OVER 150. LEANED MIXTURE TEMPORARILY FIXED PROBLEM, BUT RICHER MIXTURE BROUGHT PROBLEM BACK.",2015-02-03,"DURING TROUBLESHOOTING ALSO FOUND P-LEADS TO BE INSTALLED ON WRONG MAGS. REROUTED WIRES TO CORRECT MAGS. REINSTALLED BOTH UPPER & LOWER PLUGS. RAN A/C, OPS CK GOOD.",c_31,mixture adjust mixture control
1141040,2015-02-03 22:52:00,2015-02-04 10:34:00,N576ND,10827.3,7100.0,"UPON ENTERING RUNWAY & ADDING FULL POWER, ENG STARTED TO SPUTTER; FAIL TO RUN SMOOTHLY.",2015-02-03,"MAX RUN UP 2250 RPM, MAGS CK GOOD. IDLE & RISE GOOD, TEMP FOR #4 CYL 200 HIGHER EGT THAN ALL OTHERS. COULD NOT ACCELERATE W/O POPPING OR ADDING LEAN MIXTURE.",c_31,mixture adjust mixture control
1141106,2015-02-05 06:56:00,2015-02-05 15:10:00,N571ND,7320.9,400.0,"AD 2001-06-17, IMPROPER FUEL FLOW SETTING DUE. EFF DATE 4/20/01.",2015-02-05,"RAN A/C, ADJUSTED IDLE RPM & MIXTURE FOR SEASONAL CONDITIONS. NEXT DUE ON CONDITION.",c_31,mixture adjust mixture control
1141198,2015-02-07 09:57:00,2015-03-05 13:41:00,N604ND,2202.2,7320.0,MIXTURE RICH.,2015-03-05,ADJUSTED FUEL CONTROL.,c_31,mixture adjust mixture control
1141300,2015-02-11 14:04:00,2015-02-12 10:46:00,N570ND,12576.8,7200.0,ENG CHANGE DUE.,2015-02-12,"FINISHED ENGINE INSTALLATION. INSTALLED, ROUTED & SECURED ALL FLUID LINES. ROUTED & SECURED ELECTRICAL LINES. PRE-OILED ENGINE, PUT IN MINERAL OIL. CONNECTED & OPS CK'ED, ADJUSTED THROTTLE & MIXTURE CONTROL. RAN ENGINE, OPS & LEAK CK GOOD.",c_31,mixture adjust mixture control
1141393,2015-02-16 06:53:00,2015-02-16 14:35:00,N575ND,10973.7,400.0,"AD 2001-06-17, IMPROPER FUEL FLOW SETTINGS DUE. EFF DATE 4/20/01.",2015-02-16,"C/W AD, ADJUSTED IDLE SPEED & MIXTURE. NEXT DUE @ 4807.3 TACH.",c_31,mixture adjust mixture control
1141532,2015-02-19 06:09:00,2015-02-19 14:46:00,N655ND,1246.5,7320.0,MIXTURE NEEDS ADJUSTMENT.,2015-02-19,"UPON FURTHER RUN UP, FOUND MIXTURE TO BE IN LIMITS.",c_31,mixture adjust mixture control
1141534,2015-02-19 06:33:00,2015-02-19 14:38:00,N652ND,1321.1999999999998,7200.0,THROTTLE AT IDLE ENGINE RAN ROUGH.,2015-02-19,RAN UP ENGINE TO OPERATING TEMPS. ENGINE IDLE SPEED & MIXTURE CK GOOD. MAG DROPS CK GOOD. ENGINE OPERATES SMOOTH AT THIS TIME.,c_31,mixture adjust mixture control
1141591,2015-02-20 07:48:00,2015-03-05 13:46:00,N543ND,12436.0,7310.0,MIXTURE INCORRECT.,2015-03-05,ADJUSTED FUEL CONTROL.,c_31,mixture adjust mixture control
1141592,2015-02-20 09:50:00,2015-02-20 11:03:00,N570ND,13911.3,400.0,"AD 2001-06-17, IMPROPER FUEL FLOW SETTINGS DUE. EFF DATE 4/20/01.",2015-02-20,C/W AD. HAD TO ADJUST IDLE & MIXTURE. NEXT DUE 5056.9 TACH.,c_31,mixture adjust mixture control
1141647,2015-02-23 06:00:00,2015-02-23 13:00:00,N569ND,15249.7,7600.0,BOLT LOOSE ON MIXTURE ROD END.,2015-02-23,TIGHTENED NUT & SAFETIED W/ COTTER PIN.,c_31,mixture adjust mixture control
1141782,2015-02-25 18:42:00,2015-02-26 11:15:00,N516ND,10386.6,7100.0,"DURING CLIMB OUT, ENGINE SPUTTERED. LEANED MIXTURE & ENGINE RAN ROUGH. COMPLETED ENGINE ROUGHNESS CHECKLIST & NOTED 300-400 RPM DROP W/ MAGS ON LEFT.",2015-02-25,"PERFORMED GROUND RUN, NO DEFECTS NOTED. MAG CK DIFFERENTIAL WAS @ 50 RPM, BUT W/IN LIMITS. RESEARCHED MFD CARD DATA, NO DEFECTS NOTED.",c_31,mixture adjust mixture control
1141782,2015-02-25 18:42:00,2015-02-26 11:15:00,N516ND,10386.6,7100.0,"DURING CLIMB OUT, ENGINE SPUTTERED. LEANED MIXTURE & ENGINE RAN ROUGH. COMPLETED ENGINE ROUGHNESS CHECKLIST & NOTED 300-400 RPM DROP W/ MAGS ON LEFT.",2015-02-26,SEE W/O #1141799 FOR MAINTENANCE FLIGHT.,c_31,mixture adjust mixture control
1141791,2015-02-26 06:27:00,2015-02-26 13:22:00,N507ND,11278.7,7100.0,"DID COLD START. WHEN ENGAGING STARTER, SAW ORANGE/RED LIGHT COMING FROM NOSE OF A/C. DID ENGINE FIRE CHECKLIST.",2015-02-26,"INSPECTED ENGINE & COWL, NO DEFECTS NOTED. RAN A/C, IDLE RPM, MIXTURE & MAG CK GOOD. NO DEFECTS NOTED.",c_31,mixture adjust mixture control
1142124,2015-03-07 14:25:00,2015-03-21 14:23:00,N635ND,4507.200000000001,7310.0,FUEL CONTROL REQUIRES ADJUSTMENT.,2015-03-21,ADJUSTED MIXTURE.,c_31,mixture adjust mixture control
1142370,2015-03-13 09:17:00,2015-03-26 09:49:00,N543ND,12577.3,7320.0,FUEL CONTROL LOOSE.,2015-03-26,REPLACED BASE GASKETS & ADJUSTED FUEL CONTROL.,c_31,mixture adjust mixture control
1142446,2015-03-16 12:30:00,2015-03-19 11:14:00,N575ND,11229.0,400.0,"AD 2001-06-17, IMPROPER FUEL FLOW SETTINGS DUE. EFF DATE 4/20/01.",2015-03-19,"C/W AD, SET IDLE SPEED & MIXTURE. NEXT DUE @ 4892.4 TACH.",c_31,mixture adjust mixture control
1142446,2015-03-16 12:30:00,2015-03-19 11:14:00,N575ND,11229.0,7200.0,ENGINE CHANGE DUE.,2015-03-19,"INSTALLED EXHAUST, PRE-OILED ENGINE. FINISHED INSTALLING ENGINE BAFFLES. INSTALLED SPINNER & ENGINE COWLING. RUN UP A/C, SET IDLE SPEED & IDLE MIXTURE. OPS & LEAK CK GOOD.",c_31,mixture adjust mixture control
1142511,2015-03-18 09:47:00,2015-03-24 14:13:00,N557ND,12551.8,520.0,ENGINE CHANGE DUE.,2015-03-23,"PRE-OILED ENGINE. INSTALLED PLUGS. RAN ENGINE, LEAK CK'ED OK. SET IDLE SPEED & MIXTURE - SEE PD #17 FOR AD REFERENCE.",c_31,mixture adjust mixture control
1142590,2015-03-20 06:51:00,2015-03-20 13:12:00,N536ND,11753.2,7610.0,"ENGINE QUIT AT IDLE WHEN THROTTLE WAS AT IDLE, DURING SHUT DOWN. 2 RESTART ATTEMPTS W/O SUCCESS.",2015-03-20,"RAN A/C, MAGS CK'ED GOOD. ADJUSTED IDLE RPM & MIXTURE FOR SEASONAL CONDITIONS. STARTED A/C MULTIPLE TIMES. OPS CK GOOD.",c_31,mixture adjust mixture control
1142629,2015-03-23 06:24:00,2015-03-30 13:07:00,N688ND,599.0,7610.0,L/H MIXTURE CONTROL NOT REACHING STOP ON CARB.,2015-03-23,ADJUSTED MIXTURE CONTROL.,c_31,mixture adjust mixture control
1142698,2015-03-24 14:18:00,2015-03-25 10:39:00,N524ND,12599.6,7320.0,FUEL SERVO DUE AT ENGINE CHANGE.,2015-03-24,REMOVED & REPLACED FUEL SERVO W/ S/N 70D87905. HOOKED UP MIXTURE & THROTTLE CABLES AND SAFETIED. TRAVEL CK OK.,c_31,mixture adjust mixture control
1142698,2015-03-24 14:18:00,2015-03-25 10:39:00,N524ND,12599.6,400.0,"AD 2001-06-17, IMPROPER FUEL FLOW SETTINGS DUE. EFF DATE 4/20/01.",2015-03-25,"C/W AD, ADJUSTED MIXTURE AS NEEDED. NEXT DUE @ 4661.8 TACH.",c_31,mixture adjust mixture control
1142948,2015-04-02 06:15:00,2015-04-10 15:04:00,N531ND,11339.2,7200.0,ROUGH ENGINE.,2015-04-10,"OPERATED ENGINE AT ALL POWER SETTINGS W/O ANY DISCREPANCIES NOTED. CK MIXTURE ADJUSTMENT, IDLE SPEED @ ENGINE INDICATING, ALL OPERATIONS NORMAL.",c_31,mixture adjust mixture control
1142996,2015-04-04 09:51:00,2015-04-10 14:59:00,N543ND,12790.3,7310.0,MIXTURE & IDLE OUT OF SPECS.,2015-04-10,ADJUSTED FUEL CONTROL.,c_31,mixture adjust mixture control
1143051,2015-04-06 13:20:00,2015-04-07 15:36:00,N527ND,9563.8,7320.0,IDLE SPEED & MIXTURE NEED SEASONAL ADJUSTMENT.,2015-04-07,PERFORMED SEASONAL ADJUSTMENTS ON IDLE SPEED & MIXTURE.,c_31,mixture adjust mixture control
1143104,2015-04-08 13:27:00,2015-04-09 10:53:00,N538ND,12115.3,7320.0,FUEL SERVO TIMED OUT.,2015-04-08,INSTALLED NEW FUEL SERVO S/N 70486510 ON OVERHAULED ENGINE. HOOKED UP FUEL LINES. HOOKED UP THROTTLE & MIXTURE CABLES. SAFETIED.,c_31,mixture adjust mixture control
1143185,2015-04-11 10:47:00,2015-04-11 13:51:00,N561ND,9886.8,7100.0,"DURING RUN UP, ON IDLE CK, ENGINE RAN ROUGH & DROPPED TO 450 RPM. THEN ENGINE DIED. RESTARTED & TAXIED BACK TO RAMP.",2015-04-11,RAN A/C & FOUND IDLE MIXTURE OUT OF SPECS. ADJUSTED MIXTURE FOR SEASONAL TEMPERATURE CONDITIONS. OPS CK GOOD.,c_31,mixture adjust mixture control
1143200,2015-04-13 06:13:00,2015-04-22 13:38:00,N531ND,11441.2,7320.0,FUEL CONTROL REQUIRES ADJUSTMENT.,2015-04-22,ADJUSTED MIXTURE & IDLE SPEED.,c_31,mixture adjust mixture control
1143299,2015-04-16 10:04:00,2015-04-16 14:47:00,N557ND,9134.5,7610.0,IDLE MIXTURE REQUIRES ADJUSTMENT.,2015-04-16,ADJUSTED IDLE MIXTURE FOR SEASONAL CHANGE AS REQUIRED.,c_31,mixture adjust mixture control
1143299,2015-04-16 10:04:00,2015-04-16 14:47:00,N557ND,9134.5,7610.0,IDLE MIXTURE REQUIRES ADJUSTMENT.,2015-04-16,PREFORMED ENGINE RUN NOTING ACCEPTABLE RPM RISE ACCORDING TO SEPCS. OPS CK GOOD. NO FURTHER DEFECTS NOTED @ THIS TIME.,c_31,mixture adjust mixture control
1143366,2015-04-20 06:16:00,2015-04-23 09:57:00,N572ND,12896.1,2800.0,FUEL INJECTION SERVO NEEDS TO BE CHANGED.,2015-04-21,"INSTALLED NEW SERVO S/N 70A89702, CONNECTED MIXTURE, THROTTLE LINKAGES, FUEL LINES. SAFETIED BOLTS.",c_31,mixture adjust mixture control
1143366,2015-04-20 06:16:00,2015-04-23 09:57:00,N572ND,12896.1,400.0,"AD 2001-06-17, IMPROPER FUEL FLOW SETTINGS DUE. EFF DATE 4/20/01.",2015-04-23,C/W AD FOR MIXTURE & IDLE SETTINGS. NEXT DUE @ 5185.2 TACH.,c_31,mixture adjust mixture control
1143584,2015-04-27 06:15:00,2015-04-29 14:52:00,N515ND,14432.8,7300.0,FUEL INJECTION SERVO DUE CHANGE.,2015-04-29,ADJUSTED IDLE MIXTURE IAW AD 2001-06-17. NO OTHER DEFECTS NOTED AT THIS TIME. NO LEAKS NOTED.,c_31,mixture adjust mixture control
1143663,2015-04-28 13:50:00,2015-05-01 13:18:00,N508ND,11707.400000000001,7320.0,IDLE SPEED NOTED LOW DURING POST PHASE RUN UP.,2015-05-01,PERFORMED SEASONAL ADJUSTMENT TO IDLE SPEED AS REQUIRED. IDLE SPEED & MIXTURE SET ACCORDING TO SPECS. OPS CK GOOD.,c_31,mixture adjust mixture control
1143718,2015-04-30 05:50:00,2015-05-12 11:11:00,N540ND,11123.7,7300.0,LOOSE MIXTURE KNOB.,2015-05-12,TORQUED MIXTURE HOUSING NUT.,c_31,mixture adjust mixture control
1143945,2015-05-08 06:23:00,2015-05-18 10:46:00,N606ND,5418.9,7310.0,FUEL CONTROL REQUIRES ADJUSTMENT.,2015-05-18,ADJUSTED MIXTURE & IDLE.,c_31,mixture adjust mixture control
1144059,2015-05-13 06:08:00,2015-05-13 13:17:00,N509ND,14094.4,7300.0,MIXTURE TOO RICH.,2015-05-13,SEASONALLY ADJUSTED MIXTURE.,c_31,mixture adjust mixture control
1144059,2015-05-13 06:08:00,2015-05-13 13:17:00,N509ND,14094.4,7300.0,MIXTURE TOO RICH.,2015-05-13,POST ENGINE RUN UP PERFORMED NOTING IDLE SPEED & MIXTURE W/IN SPECS. OPS CK GOOD.,c_31,mixture adjust mixture control
1144124,2015-05-15 11:28:00,2015-05-26 10:11:00,N605ND,5738.1,7310.0,FUEL CONTROL REQUIRES ADJUSTMENT.,2015-05-26,ADJUSTED MIXTURE & IDLE SPEED.,c_31,mixture adjust mixture control
1144213,2015-05-19 14:02:00,2015-05-19 14:42:00,N527ND,9853.9,7200.0,"WHILE PERFORMING GO-AROUND @ D37 ON CLIMBOUT, ENGINE SPUTTERED WHILE @ FULL POWER W/ MIXTURE FULL. SPUTTER LASTED ABOUT 1-2 SECONDS. FLEW BACK TO GFK W/O ANY REPETITION OF SPUTTER.",2015-05-19,RAN A/C & PERFORMED GROUND RUN SEVERAL TIMES. COULD NOT DUPLICATE DISCREPANCY.,c_31,mixture adjust mixture control
1144393,2015-05-26 06:21:00,2015-05-26 14:53:00,N522ND,16971.6,7300.0,FUEL SERVO IDLE SPEED REQUIRES SEASONAL ADJUSTMENT.,2015-05-26,IDLE SPEED 700 RPM & MIXTURE RISE 10 RPM.,c_31,mixture adjust mixture control
1144417,2015-05-26 11:57:00,2015-05-26 14:41:00,N523ND,11245.6,7300.0,"ON RUN UP, MAG CK GOOD. UPON PULLING THROTTLE TO IDLE, ENGINE DIED. ATTEMPTED RESTART 3 TIMES & STARTED W/ FLOODED START.",2015-05-26,PERFORMED SEASONAL ADJUSTMENT OF IDLE SPEED & MIXTURE TO CESSNA GLOBAL AMOC PAR 1B SPECS. OPS CK GOOD.,c_31,mixture adjust mixture control
1144472,2015-05-27 18:35:00,2015-05-29 13:34:00,N559ND,17806.5,7300.0,IDLE SPEED LOW DURING ENGINE RUN UP.,2015-05-29,"PERFORMED RUN UP, IDLE SPEED & MIXTURE SET W/IN LIMITS. OPS CK GOOD.",c_31,mixture adjust mixture control
1144501,2015-05-28 21:46:00,2015-06-03 12:43:00,N602ND,6038.4,7200.0,ROUGH ENGINE; 800 TO 1100 RPM.,2015-06-03,"PERFORMED EXTENDED GROUND RUN, ALL POWER SETTINGS, MIXTURE & IDLE CHECKS, CK'ED MAGNETO OPERATION, NO DISCREPANCIES NOTED.",c_31,mixture adjust mixture control
1144508,2015-05-29 08:55:00,2015-05-29 14:22:00,N536ND,12230.800000000001,7720.0,"NOTICED ON CRUISE FLIGHT WHEN LEANING MIXTURE, CYL #2 WAS NOT INDICATING TEMP. FINALLY INDICATED TEMP BUT WAS LOWER THAN REST.",2015-05-29,OPS CK GOOD.,c_31,mixture adjust mixture control
1144508,2015-05-29 08:55:00,2015-05-29 14:22:00,N536ND,12230.800000000001,7720.0,"NOTICED ON CRUISE FLIGHT WHEN LEANING MIXTURE, CYL #2 WAS NOT INDICATING TEMP. FINALLY INDICATED TEMP BUT WAS LOWER THAN REST.",2015-05-29,REMOVED & REPLACED CYL #2 EGT PROBE W/ NEW.,c_31,mixture adjust mixture control
1144547,2015-06-01 06:20:00,2015-06-02 11:06:00,N569ND,16005.400000000001,7300.0,SEASONAL MIXTURE ADJUSTMENT REQUIRED.,2015-06-01,ADJUSTED IDLE MIXTURE AS REQUIRED FOR SEASONAL CHANGES.,c_31,mixture adjust mixture control
1144547,2015-06-01 06:20:00,2015-06-02 11:06:00,N569ND,16005.400000000001,7300.0,SEASONAL MIXTURE ADJUSTMENT REQUIRED.,2015-06-02,PERFORMED ENGINE RUN UP NOTING IDLE SPEED & MIXTURE SET W/IN ACCEPTBALE MARGINS.,c_31,mixture adjust mixture control
1144747,2015-06-08 10:37:00,2015-06-09 00:00:00,N655ND,1884.3000000000002,7100.0,ON INITIAL CLIMB OUT AT FULL RICH MIXTURE THE ENGINE LOST SEVERAL HUNDRED RPMS RAPIDLY AND RETURNED TO 2450. WE RETURNED TO KGFK,2015-06-09,"RAN AIRCRAFT. MAG. CHECK, POWER CHECK, AND IDLE RPM AND MIXTURE CHECKS GOOD. COULD NOT DUPLICATE DISCRPENCY. SEE WORKORDER #1144776 FOR MAINTENANCE FLIGHT",c_31,mixture adjust mixture control
